{
  "clientId": "summit-consulting",
  "type": "site",
  "title": "Summit Consulting - Strategic Business Advisory",
  "site": { "baseUrl": "" },
  "nav": {
    "logo": "Summit Consulting",
    "links": [
      { "label": "Home", "href": "home.html" },
      { "label": "About", "href": "about.html" },
      { "label": "Services", "href": "services.html" },
      { "label": "Portfolio", "href": "portfolio.html" },
      { "label": "Blog", "href": "blog-listing.html" },
      { "label": "Pricing", "href": "pricing.html" }
    ],
    "cta": { "label": "Contact Us", "href": "contact.html" }
  },
  "footer": {
    "logo": "Summit Consulting",
    "tagline": "Empowering businesses to reach their peak potential.",
    "companyName": "Summit Consulting Group",
    "navGroups": [
      {
        "title": "Company",
        "links": [
          { "label": "About", "href": "about.html" },
          { "label": "Services", "href": "services.html" },
          { "label": "Portfolio", "href": "portfolio.html" },
          { "label": "Pricing", "href": "pricing.html" }
        ]
      },
      {
        "title": "Resources",
        "links": [
          { "label": "Blog", "href": "blog-listing.html" },
          { "label": "Contact", "href": "contact.html" }
        ]
      }
    ],
    "social": [
      { "label": "LinkedIn", "url": "https://linkedin.com/company/summit-consulting", "icon": "linkedin" },
      { "label": "Twitter", "url": "https://twitter.com/summitconsult", "icon": "twitter" },
      { "label": "GitHub", "url": "https://github.com/summit-consulting", "icon": "github" }
    ],
    "legalLinks": [
      { "label": "Terms of Service", "href": "terms-privacy.html#terms" },
      { "label": "Privacy Policy", "href": "terms-privacy.html#privacy" }
    ]
  },
  "home": {
    "title": "Summit Consulting - Strategic Business Advisory",
    "metaDescription": "Summit Consulting helps businesses grow through strategic advisory, digital transformation, and operational excellence.",
    "hero": {
      "headline": "Elevate Your Business to New Heights",
      "subtitle": "Strategic advisory and digital transformation for companies that want to lead, not follow.",
      "cta": { "label": "Get a Free Consultation", "href": "contact.html" },
      "secondaryCta": { "label": "View Our Work", "href": "portfolio.html" }
    },
    "services": {
      "headline": "How We Help",
      "subheadline": "We bring clarity, strategy, and execution to your most complex business challenges.",
      "items": [
        {
          "title": "Strategy Consulting",
          "description": "Data-driven strategic planning that aligns your team and accelerates growth.",
          "icon": "&#x1F3AF;",
          "cta": { "label": "Learn More", "href": "services.html" }
        },
        {
          "title": "Digital Transformation",
          "description": "Modernize operations with technology that scales and delivers measurable ROI.",
          "icon": "&#x1F4BB;",
          "cta": { "label": "Learn More", "href": "services.html" }
        },
        {
          "title": "Operational Excellence",
          "description": "Streamline processes, reduce waste, and build a culture of continuous improvement.",
          "icon": "&#x2699;&#xFE0F;",
          "cta": { "label": "Learn More", "href": "services.html" }
        }
      ]
    },
    "portfolio": {
      "headline": "Selected Work",
      "subheadline": "A few examples of how we have helped our clients achieve outstanding results.",
      "items": [
        {
          "title": "FinTech Scale-Up",
          "category": "Strategy",
          "description": "Helped a fintech startup scale from 10 to 200 employees in 18 months."
        },
        {
          "title": "Retail Digital Overhaul",
          "category": "Digital",
          "description": "End-to-end digital transformation for a national retail chain."
        },
        {
          "title": "Manufacturing Optimization",
          "category": "Operations",
          "description": "Reduced manufacturing costs by 23% through process optimization."
        }
      ]
    },
    "trustSignals": [
      { "stat": "150+", "label": "clients served" },
      { "stat": "98%", "label": "satisfaction rate" },
      { "stat": "$2.1B", "label": "client revenue impacted" },
      { "stat": "12", "label": "years of experience" }
    ],
    "cta": {
      "headline": "Ready to Transform Your Business?",
      "copy": "Schedule a free consultation with our senior advisors. No commitment, just clarity.",
      "label": "Book Your Consultation",
      "href": "contact.html"
    }
  },
  "about": {
    "title": "About Us",
    "headline": "About Summit Consulting",
    "subtitle": "We are a team of senior advisors, technologists, and operators dedicated to helping businesses reach their peak potential.",
    "story": {
      "headline": "Our Story",
      "content": "<p>Founded in 2014, Summit Consulting was born from a simple observation: too many businesses invest in strategy without the operational muscle to execute it. Our founders, each with 20+ years in Fortune 500 leadership, set out to build a firm that bridges the gap between vision and execution.</p><p>Today, we serve over 150 clients across technology, finance, retail, and manufacturing — delivering measurable results that compound year over year.</p>"
    },
    "team": {
      "headline": "Meet the Team",
      "subheadline": "Senior advisors with decades of real-world leadership experience.",
      "members": [
        { "name": "Alexandra Chen", "role": "Managing Director", "bio": "Former VP Strategy at Deloitte. 20+ years in management consulting." },
        { "name": "Marcus Rivera", "role": "Head of Digital", "bio": "Led digital transformation at three Fortune 100 companies." },
        { "name": "Sarah Nakamura", "role": "Operations Lead", "bio": "Six Sigma Black Belt. Saved clients over $500M in operational costs." },
        { "name": "David Okafor", "role": "Technology Advisor", "bio": "Former CTO at two unicorn startups. Expert in scalable architectures." }
      ]
    },
    "values": {
      "headline": "Our Values",
      "items": [
        { "title": "Results First", "description": "We measure our success by the results we deliver to our clients, not the hours we bill.", "icon": "&#x1F4C8;" },
        { "title": "Radical Transparency", "description": "No black boxes. We share our methodology, data, and reasoning at every step.", "icon": "&#x1F50D;" },
        { "title": "Long-Term Thinking", "description": "We build strategies that compound, not quick fixes that create dependency.", "icon": "&#x1F331;" }
      ]
    },
    "timeline": {
      "headline": "Our Journey",
      "items": [
        { "year": "2014", "title": "Founded", "description": "Summit Consulting established in San Francisco." },
        { "year": "2016", "title": "50 Clients", "description": "Reached 50 active clients across 3 industries." },
        { "year": "2019", "title": "Digital Practice", "description": "Launched dedicated digital transformation practice." },
        { "year": "2022", "title": "International", "description": "Expanded to Europe and Asia-Pacific markets." },
        { "year": "2024", "title": "150+ Clients", "description": "Surpassed 150 clients with 98% satisfaction rating." }
      ]
    }
  },
  "services": {
    "title": "Services",
    "headline": "Our Services",
    "subtitle": "Comprehensive advisory services designed to drive measurable business outcomes.",
    "items": [
      {
        "title": "Strategy Consulting",
        "description": "Market analysis, competitive positioning, growth strategy, and M&A advisory. We help you define where to play and how to win.",
        "icon": "&#x1F3AF;",
        "cta": { "label": "Get Started", "href": "contact.html" }
      },
      {
        "title": "Digital Transformation",
        "description": "Technology roadmaps, system modernization, data strategy, and change management. Modernize without disrupting operations.",
        "icon": "&#x1F4BB;",
        "cta": { "label": "Get Started", "href": "contact.html" }
      },
      {
        "title": "Operational Excellence",
        "description": "Process optimization, lean methodology, supply chain improvement, and quality management. Do more with less.",
        "icon": "&#x2699;&#xFE0F;",
        "cta": { "label": "Get Started", "href": "contact.html" }
      },
      {
        "title": "Leadership Development",
        "description": "Executive coaching, team alignment, culture building, and succession planning. Build leaders who build companies.",
        "icon": "&#x1F465;",
        "cta": { "label": "Get Started", "href": "contact.html" }
      },
      {
        "title": "Financial Advisory",
        "description": "Financial modeling, fundraising strategy, investor relations, and due diligence. Make confident financial decisions.",
        "icon": "&#x1F4B0;",
        "cta": { "label": "Get Started", "href": "contact.html" }
      },
      {
        "title": "Innovation Programs",
        "description": "Innovation workshops, rapid prototyping, market testing, and corporate venture building. Turn ideas into revenue.",
        "icon": "&#x1F4A1;",
        "cta": { "label": "Get Started", "href": "contact.html" }
      }
    ],
    "comparisonTable": {
      "headline": "Compare Our Engagement Models",
      "headers": ["Feature", "Advisory", "Project-Based", "Retainer"],
      "rows": [
        ["Duration", "1-3 months", "3-6 months", "Ongoing"],
        ["Team Size", "1-2 advisors", "3-5 specialists", "Dedicated team"],
        ["Deliverables", "Strategy report", "Full implementation", "Continuous optimization"],
        ["Best For", "Quick assessment", "Specific initiative", "Long-term partnership"],
        ["Starting Price", "$25,000", "$75,000", "$15,000/mo"]
      ]
    },
    "cta": {
      "headline": "Not Sure Which Service You Need?",